{
  "schemaVersion": "hybrid-intake-v1",
  "taskId": "task-001",
  "request": {
    "rawText": "Fix the sync issue",
    "normalizedObjective": "Fix sync",
    "requestType": "bug",
    "constraints": [],
    "acceptanceCriteria": ["sync completes"]
  },
  "scope": {
    "project": "demo",
    "repository": "/repo",
    "repositoryRef": "main",
    "domain": "mobile",
    "sourceFingerprint": "sha-001"
  },
  "behavior": {
    "current": "stuck",
    "expected": "complete",
    "reproduction": "reopen app",
    "userImpact": "sync unavailable"
  },
  "evidence": {},
  "candidateProjection": null,
  "reconciliation": {},
  "execution": {},
  "verification": {},
  "learning": {},
  "state": {}
}
